{
  "$schema": "https://json-schema.org/draft/2020-12/schema",
  "$id": "https://mova.dev/schemas/env.security_event_store_v1.schema.json",
  "title": "env.security_event_store_v1",
  "description": "Envelope for storing a MOVA security event episode in a security log or store.",
  "type": "object",
  "properties": {
    "envelope_id": {
      "type": "string",
      "const": "env.security_event_store_v1"
    },
    "verb": {
      "type": "string",
      "const": "record"
    },
    "roles": {
      "type": "object",
      "description": "Who records the event and which store receives it.",
      "properties": {
        "producer": {
          "type": "string",
          "description": "Identifier of the producer of this event (service id, guard id, etc.)."
        },
        "security_store": {
          "type": "string",
          "description": "Identifier of the target security store or log."
        }
      },
      "required": [
        "producer",
        "security_store"
      ],
      "additionalProperties": false
    },
    "event": {
      "$ref": "https://mova.dev/schemas/ds.security_event_episode_core_v1.schema.json"
    },
    "meta": {
      "type": "object",
      "description": "Optional metadata for routing: correlation ids, partition keys, etc.",
      "additionalProperties": true
    }
  },
  "required": [
    "envelope_id",
    "verb",
    "roles",
    "event"
  ],
  "additionalProperties": false
}
