{
  "envelope_id": "env.security_event_store_v1",
  "verb": "record",
  "roles": {
    "producer": "mova-sandbox-llm-guard",
    "security_store": "mova-core-security-log-local"
  },
  "event": {
    "schema_id": "ds.security_event_episode_core_v1",
    "episode_id": "sec-evt-0001",
    "episode_type": "security_event/prompt_injection_suspected",
    "mova_version": "4.1.0",
    "recorded_at": "2025-12-07T00:00:00Z",
    "executor": {
      "role": "guard",
      "executor_id": "mova-sandbox-llm-guard",
      "executor_kind": "service",
      "environment": {
        "runtime": "sandbox",
        "version": "1.0.0"
      }
    },
    "result_status": "completed",
    "result_summary": "Prompt injection suspected in user instruction; request blocked and owner alerted.",
    "input_envelopes": [
      {
        "envelope_type": "env.instruction_profile_publish_v1",
        "envelope_id": "example-profile-publish-0001"
      }
    ],
    "security_event_type": "prompt_injection_suspected",
    "security_event_category": "instruction_misuse",
    "severity": "high",
    "policy_profile_id": "mova_security_default_v1",
    "policy_ref": {
      "policy_document_id": "mova_security_policies_v1",
      "rule_id": "no_prompt_injection",
      "policy_version": "1.0.0"
    },
    "security_model_version": "1.0.0",
    "detection_source": "runtime_guard",
    "detection_confidence": 0.9,
    "recommended_actions": [
      {
        "action_type": "alert",
        "reason": "High-risk prompt injection attempt.",
        "priority": "high"
      },
      {
        "action_type": "log",
        "reason": "Record event for later analysis.",
        "priority": "medium"
      }
    ],
    "actions_taken": [
      {
        "action_type": "block",
        "taken_at": "2025-12-07T00:00:01Z",
        "actor": "mova-sandbox-llm-guard",
        "status": "completed",
        "details": "Execution of requested tool was blocked."
      },
      {
        "action_type": "alert",
        "taken_at": "2025-12-07T00:00:02Z",
        "actor": "mova-sandbox-llm-guard",
        "status": "completed",
        "details": "Owner notified about the suspected prompt injection."
      }
    ]
  },
  "meta": {
    "created_at": "2025-12-07T00:00:00Z",
    "note": "Example of recording a prompt injection security event."
  }
}
